Title,Upvotes,Time(military),# of Comments
"Growing up poor, what was the simple thing you saw at someone's house that confirmed they were rich?",1000,6,1600
What is possibly the most worrying thing about Space?,1000,2,1400
"Has a stranger ever pulled a Sherlock on you(as in, deduce a large amount of info about you from a minor detail), and how did they do it?",1000,4,658
What would your 13 year old self think of you now?,1000,3,1600
"Martin Luther King Jr. once said, ""in the end, we will remember not the words of our enemies, but the silence of our friends."" What is a real-life story of this?",1000,3,438
What is your recommended hangover cure?,1000,2,1600
"For those of you who have ever discovered a hidden camera or microphone that was recording you, what was the end result of that whole situation?",1000,0,607
A man in a black suit walks up to you at a coffee shop. He sits down next to you and says “You know why I’m here.” What would you do?,1000,6,996
"What's your ""WE NEED TO LEAVE NOW!"" Moment?",1000,0,1000
"If Reddit had a war, which subreddit would win?",1000,3,761
"When you wake up, what’s your first thought?",1000,3,1700
"[Serious] Redditors who were In school the day of and after 9/11, what was it like? How did your school react to it?",1000,3,1000
What’s the most useless fact you know?,1000,4,1600
Do you ever feel like your family is not even family but just people that are related to you by blood and if so why ?,1000,1,518
What movie has made you laugh the hardest?,1000,4,1800
What massively used invention could you absolutely live without?,1000,0,1500
Butterfly effect. what is that trivial thing you did that caused a serious chaos later on ?,1000,3,572
What is the most passive aggressive comment?,1000,6,1000
what song has a great music but fucked up lyrics?,1000,4,1900
2020 has been a pretty bad year by almost all standards. What is the best thing that has happened to you this year? What are you thankful for?,1000,1,1200
How do you politely tell someone they are talking too much?,1000,4,618
"What is a good response to ""Do you have a moment to talk about our Lord and Savior Jesus Christ""?",1000,0,1300
"What fictional character is portrayed as good, but is actually pretty screwed up with when you think about it?",1000,1,1800
"[Serious] People who have been hugged, what does it feel like?",1000,0,681
What things instantly make a person unlikable?,1000,3,1400
What’s an inanimate object that really shouldn’t piss you off as much as it does?,1000,1,1100
What's your favorite anti-happy-ending movie?,1000,4,1600
Which movie has the best opening scene?,1000,2,1500
What historical figure was a horrible person despite everyone thinking they were great?,1000,0,2000
"Remember the 'boggart' from Harry Potter series. If you ever faced a boggart, what would it turn into, and what funny thing would you 'Ridikulus' it into ?",1000,5,504
What’s the hardest pill to swallow?,1000,2,1500
[Serious] What's the thing you're most frustrated that you will miss because it will happen after you die?,994,4,1200
"If you look into Medusa's eyes and King Midas touches you the same time, what do you think would happen?",991,4,419
"People of reddit, what is the most cherished memory with your SO, that still makes you happy to be them?",984,0,315
What is something that is illegal but is so common people think it is legal?,974,2,1400
"Americans, how do you feel about being an american right now?",974,4,2200
"What was the classiest ""fuck you"" of history?",974,0,843
Who is the most annoying main character ever?,960,5,1900
"(Serious) People who don’t do drugs (alcohol, weed, etc.), how do you manage to be happy without them?",958,0,1400
What advice do you have for someone who just turned 18 today?,953,4,1600
What has been normalised in society that really SHOULDN'T?,943,0,2000
"Women of reddit, what are some (unexpected) skills that make men attractive for you?",947,1,1200
What is a personality trait about yourself that you don’t like?,922,0,1100
"For those who have been suicidal, what was the most helpful things loved ones did/could have done? What was the least helpful?",898,0,651
"Would You Accept $1 Billion Dollars If The Condition Was You Couldn't Leave The State You Are In Currently, and Why?",895,1,1000
What TV show made you genuinely cry?,893,2,2000
What would cause you to pick up a hitchhiker?,884,1,890
What’s the worst way you ever seen someone fuckup a basic task?,889,4,1000
What random fact you would like to put here?,866,5,1400
Suicidal people of reddit what helped keep you alive at your lowest moments or what is keeping you alive?,867,6,902
"What were the darkest times of reddit, a noobie redditor should know?",880,2,844
What's a problem absolutely no one prepared you for?,863,4,1000
What heartwarming story do you have to share that could cheer up anyone on Reddit who’s feeling down right now?,860,3,250
"People of this sub, why do you keep asking horny questions?",844,4,208
Men of Reddit: What's something a woman can do to instantly melt your heart?,848,6,878
[Serious] What would you say is your biggest character flaw?,836,5,1000
What has been the most scariest moment of your life?,836,1,777
"If “Never Gonna Give You Up” never existed, what would we use instead to rick roll people?",841,5,674
Heaven is overcrowded and Hell is undercrowded because God is too soft. You need to fix this. What types of people will now go to Hell?,807,0,1100
"What is your favourite video game, and what's so good about it?",804,1,1300
"What did a child say or do that made you think, “this kid might be a future serial killer?”",799,6,842
What mostly hated movie do you actually love?,791,4,1900
What's the worst hyped up product you have ever used ?,792,1,1500
"Parents who have looked through their kids web history, what did you find?",778,0,757
"If prostitution was declared legal across the United States, what kind of marketing slogans do you think would be used for commercials?",759,2,551
What is worth dying for?,752,2,927
"If you had one do-over in life, what would it be?",748,6,880
What's your biggest fantasy?,732,4,1000
"You suddenly wake up with one superpower of your choice. However, you can only use it for fifteen minutes after doing a good deed. What’s your superpower and what deeds do you do with it?",732,5,440
"[Serious] People who have sleep paralysis demons, what’s that like?",733,6,752
What will happen to earth if humans didn't exist?,721,0,520
What is the dumbest Coronavirus theory you heard from someone?,703,5,900
[serious] Anxiety/depression sufferers: What are some ways you distract yourself to calm down/avoid spiralling?,697,4,887
"If you got offered $1,000,000 but it meant that you will never drink coffee, would you take it? Why or why not?",684,4,1300
What is a food combination that sounds disgusting in theory but is actually really delicious?,685,0,1500
"What piece of original media (movie, song, book) is already perfect and should never be remade?",679,1,1200
You now have an alt account in real life. What do you do with it?,675,4,536
What do you miss the most about the early 2000s?,672,1,1200
"What is something most people assume about you, but is actually wrong?",668,4,1100
What books would make great video games?,659,4,908
"Bob Ross just insulted you, what are you gonna do?",1000,3,1100
"You died and are about to be reborn, would you like to be the opposite sex or same sex as before and you keep all of your previous memories. What would you choose and why?",645,6,768
Which hobby did you start thinking you'll probably hate but ended up loving it instead?,629,3,609
What song are you playing on repeat?,626,4,1400
Parents of Reddit what is the most creepiest shit your kid has said or done?,622,6,521
"[Serious] What are some difficult skills that you could become impressively good at over a weekend, ie you learn 60% of the skill in short amount of time but that last 40% can take years to master?",619,4,617
"People of Reddit, who was your worst teacher, and why?",612,3,843
What was your workplace scandal?,605,4,615
What fictional character would you ever spend a day with?,604,3,868
What's almost impossible to say without doing 'the voice' for it?,604,1,1400
What is one animal that you are really afraid of?,600,6,1200
"People who have had posts blow up, did you expect it to blow up or was it a surprise?",600,1,369
What are the seven wonders of the internet?,603,3,348
What's an impossible or unethical experiment that you would like know the results of?,700,2,947
[Serious] Urban explorers whats the most scariest thing you've experienced while exploring ?,594,4,343
"If you could add 1 new sin to the bible, what would it be?",590,1,877
"What's a thing you say ""Naa, too old for that shit"" ?",589,1,1100
"You run an inconvenience store, What do you sell?",593,6,858
"Swedes of Reddit, what is it like being able to read the names of things at IKEA?",586,6,254
"What thing did you do that should have gotten you fired, but didn't?",580,2,495
"You wake up tomorrow to a Doc taking off brain monitoring sensors from your head. He hands you a hefty cheque and says “Thank you for taking part in our hyper-real sensory experiment, project 2020”. The actual date is December 1, 2019. You leave the building. What is the first thing you do?",579,3,364
[SERIOUS] Who is a severely overrated movie actor?,645,2,2500
What’s something you’re extremely passionate about?,575,0,573
"People who keep their door unlocked at night, WHY?",582,6,736
"Gay men, what’s a dead give away someone is gay but doesn’t know it yet?",577,5,583
"people who don’t just click “agree” but actually read the policies of websites, what’s the most alarming thing you’ve found?",571,2,266
"People who grind in MMO's but avoid the grind IRL, why?",566,2,421
Everyone has toxic traits. What are yours?,1000,3,1700
"What is your favorite quote, or bit of dialogue, from The Simpsons?",569,0,1000
What subject did you absolutely hate in school?,555,3,1100
"Barbers of Reddit, what terms should everyone know to make it easier to explain their haircuts?",553,0,178
You come home to find every person you have slept with sitting there. How do you start the conversation?,548,0,1200
What popular foods do you find disgusting?,544,0,1900
What's the most wrong your fast food order has ever been?,542,0,791
How were you publicly humiliated by a teacher?,537,0,808
"Fellow Americans, when was the last presidential election where you felt that both candidates were well suited for the job?",533,3,807
What is the first thing you're going to do when quarantine ends?,531,3,881
What do you collect?,529,3,1100
"What TV character was added to a cast in later seasons, and made the show much, much worse?",521,5,1000
"It is said that for every human on earth there are 1.4million ants, supposed ant were to attack us how are you prepared to deal with your 1.4million?",525,0,504
"Has anyone ever eaten at a restaurant that starred in Gordan Ramsey’s Kitchen Nightmares? Before or after the show, and if so how was the food? Is it as bad as he makes it seem?",518,1,219
"What saying, if taken literally, would be a complete disaster?",521,5,571
"You're stuck in a corner with a hord of zombies... the main characters from the last TV show you watched are there to save you. Who are they, and what is your outcome?",516,5,1400
What common parenting technique will actually really mess up your kids?,505,4,717
"What game did you decide to ""play for a few hours"" and then couldn't leave it?",514,0,769
When do you think humanity will be ready for curly mullets and giant 80s mustaches to come back?,511,6,285
What is the most useless feature in Reddit?,504,2,516
"You are given a lemon, what will you do with it?",503,3,974
What songs did you used to sing along to as a kid that you now realize were really inappropriate?,502,1,826
What is the most toxic social media site?,492,0,606
"Benjamin Franklin once said ""Tell me and I forget. Teach me and I remember. Involve me and I learn."" What is your experience with this in mind?",492,3,115
"Parents, what's the creepiest thing you remember about your child and an imaginary friend?",492,2,468
What is a food that’s actually really healthy but tastes so good you’d swear it was bad for you?,487,3,803
If 2020 was a alcoholic drink what would it be?,489,1,1400
What life changing item can you buy for less than $20?,480,3,812
What is your favorite mission from any video game?,471,5,866
What is a common cliche in movies or TV that really irritates you?,470,6,1100
"Men who ghosted women for seemingly “no reason”, what was actually your reason?",472,0,654
"Gamers of reddit, what was your first video game?",461,1,1600
What is the most wholesome act of kindness you have ever experienced/seen?,460,4,209
What do you not care about anymore?,457,0,690
What book was 100% amazing from start to finish?,453,4,1000
"You wake up one day with the power of making everyone believe what you say, truth or lie. What do you first do with your newfound power?",449,5,550
What’s the most unique item in your room right now?,449,1,1000
What is sadly true?,451,5,841
"You were just gifted a cat, the last thing you ate is it’s name, what is it?",443,1,1900
What’s something you have nostalgia for that no longer exists?,442,1,896
What would be the worst thing about living forever?,443,2,776
What are the little things in life that make you happy?,442,4,536
You come home to find your enemy's body on the floor. Everyone will suspect you did it. How do you hide the body?,442,0,557
"You discovered an asteroid, that could kill all life on Earth. How would you name it?",436,6,858
What is a great film that you will never watch again?,5000,3,4200
"Anyone who's participated in a BLM protest, anywhere in the world; What really goes on, when the cameras aren't rolling?",437,4,315
"Without saying their name, who is your favorite fictional character?",438,6,1600
"Girls of Reddit, What is the biggest turn off guys do?",434,6,1100
"Everyone has their celebrity crush, but what celebrity are you most unattracted to?",433,2,1100
What is the worst side effect from a medication that you've experienced?,427,4,1100
"If it was real, what would be the worst job from a video game?",424,6,409
What's the yummiest fruit for you?,418,0,890
What’s a fate worse than death?,418,4,761
"What screams ""I am lonely""?",739,3,934
What’s the scariest subreddits you know?,413,4,438
"If alcohol is liquid courage, what kind of buffs do other liquids give you?",407,0,385
How did you lose the genetic lottery?,411,4,1100
If you could replace any actor in an existing movie with Danny Devito which role would you put him in?,409,2,642
"If 13 year old you, saw you now what would they think of you?",408,1,723
What is something interesting about you?,403,5,785
"Ex-Atheists of Reddit, what made you believe in God?",403,3,739
What happened to you that sounds fake but isn't?,399,0,626
"What’s the largest, most pointless and possibly confusing item under $50 you could buy online to have delivered to your friend’s house?",404,3,315
What do you find oddly attractive?,403,5,628
What is your favourite memory with your grandparents?,396,2,337
Your wedding is being planned by the cast of the last show you watched. Who’s planning your wedding?,394,1,1400
What tiny thing instantly ruins your day when it happens?,394,2,668
How do you think Covid-19 will change Halloween this year?,388,1,481
"People who had cancer, how did you realize you had cancer?",385,6,342
What caused you to quit something you loved doing?,390,6,602
"Without saying it’s name, what is your favourite game? How would you describe it?",386,4,1800
Why are you still alive?,387,4,1100
What's your cure for boredom?,384,1,489
What is a bizarre phobia you have?,382,1,1100
"Formerly suicidal people of Reddit, what was the motivation to not finish yourself off? [Serious]",385,5,568
"Americans of Reddit, What are some questions you have for British people/Britain in general?",380,0,2900
Which Kid-Friendly Character would be a great guest character in Mortal Kombat?,381,4,401
What show/movie do you wish you had never watched? Why?,379,1,1100
You get to rename COVID-19. What do you call it?,384,4,707
What is so frequently touted as “underrated” that it has now crossed over to being overrated?,370,2,523
what’s your favorite band’s name without saying it?,371,5,1600
What made you happy today?,355,1,467
What is your favorite video game OST?,362,5,846
What was a mistake you commited in your life you'd like other redditors not to commit?,360,6,494
What’s one positive thing that’s happened in your life because of COVID?,357,4,680
People of Reddit. Why is it that the death of a stranger can sometimes affect you more than that of a family member?,363,5,157
"If you could add a new feature in Reddit, what would it be?",352,2,409
What would your first words on another planet be?,352,2,673
Which famous person uses reddit?,361,2,409
What do you have more of now than you did 8 months ago?,350,1,1100
"You are approached by a frenzied scientist, who yells, ""I'm going to put my quantum harmonizer in your photonic resonation chamber!"" How do you respond?",347,2,382
"If you could replace the word ""Girl"" with the word ""Squirrel"" in any song title or lyric, what would the new version be?",347,0,579
What song do you think is playing in hell 24 hours straight?,347,1,807
"You just won 1M dollars, what’s the first thing you buy?",345,4,934
What huge trend did we all forget about?,341,4,824
Jeff Bezos leaves you his fortune of $204.6 billion. What do you do with the money?,345,3,944
Which characters have the best arcs from the start of a tv show to the end?,340,6,724
"People of reddit, which one book, only one book do you think that every person on this planet should read before they die?",343,1,747
"People who quit their 9-5 job to follow their passion, what did you do and how did it turn out for you?",336,4,215
Your username is the next 2020 disaster. How screwed are we?,340,3,1500
You get a nickel every time you cuss. How rich are you?,339,0,644
What’s a time when you met someone but something just felt “off” about them? What happened?,327,3,284
How do you cope with not really caring much about anything and not wanting to do anything and finding yourself staring at a monitor all day?,335,4,176
"[serious] If you have a bad morning and you’re grumpy, how do you change your mood and have a better afternoon?",333,0,295
What is a stupid name to give to a child?,327,2,1000
What triggers you to start having a crush on someone?,328,1,422
What was the most fuck up moment in school that cause something to be banned?,323,4,351
Which three unrelated movies would make the most sensical trilogy?,325,5,208
What's your favorite thing about the house you grew up in?,322,1,412
"People who were born and raised in America who moved to another country, what have you learned?",320,6,364
"When someone returns a dish to you, do you rewash it, even if they say it's clean? Why or why not?",318,1,183
What is the book you will always recommend?,319,6,636
What is your funniest or strangest wrong number situation?,322,6,364
"If you could give your pet 1 superpower, what would it be?",316,1,363
Which celebrity or band has the worst fan base?,312,6,755
What is your country without saying its name?,312,2,2200
What song has been stuck in your head today?,309,0,889
"People who have dark senses of humor, what are some dark jokes that made you laugh?",309,4,485
"Autistic people of Reddit, what is autism really like?",307,3,348
What's something alot of people don't know is a scam?,309,2,708
What is one thing that changed your life and that you’d recommend to everybody?,305,5,389
The world is ending. What song is playing in the credits ?,302,0,833
"Redditors who work behind the scenes in the political government. What really goes on in your boardroom meetings that makes you think ‘’Yep, this is why no one trusts politicians’’?",302,5,127
What is your favourite quote?,306,4,603
"Without revealing your actual age, how old are you?",299,4,1700
"People of reddit, what is one MAJOR problem with the current Gen Z and how can we solve it?",302,4,843
You are going to make a hybrid of human and an animal. Which animal would you choose?,300,6,500
Men of Reddit- What do you know about being a boy/man that a single mother likely does not?,304,3,503
How would you alter the ending of a famous movie or book?,299,0,587
"[Serious] People who don't let things people say bother them, how do you do it?",298,4,400
Which Fictional Character is 100% too overpowerful?,298,0,863
Which fictional character do you hate most?,298,6,963
"What movies are not commonly known about, but are incredibly good?",297,0,771
How can you identify intelligent people?,292,5,494
What is your favourite accent?,296,4,756
Australians of Reddit: What non-Australian creature scares the hell out of you?,297,0,558
How did you become a Redditor?,297,0,564
What is something you want to get off your chest but don't have anyone to talk to about it?,291,0,676
"What is most childish thing, for your age, that you are still doing to this day?",297,5,560
"If you were an NPC, what quest would you be offering players and what would be the reward?",293,2,299
"Have you ever misinterpreted a song lyric in a way sounds better than the actual song lyric? If so, what was it?",290,6,408
"Redditors, when did a teacher wrongfully punish you or your classmates?",290,0,3
What fictional character do you aspire to be like personality wise?,290,4,507
What are some movies where the bad guys win?,284,2,693
"Redditors that can lucid dream frequently and on purpose, what tips do you have for beginners trying to learn how?",289,4,172
"Your username is now a cure, what's the disease?",284,4,1300
What 'Life Pro Tip' has actually improved your life?,285,1,320
Which two bands would hate each other the most based on names alone?,281,0,339
"What ""life minigames"" (like stopping the microwave right before zero) do you like to play?",284,6,323
What's a toxic trait you have?,285,4,580
What song has been your jam recently?,280,6,734
"Amish people who’ve joined the modern times, do you miss it? What happened to make you leave?",279,6,99
How rich are you?,278,3,760
"If your entire life was revealed to the internet, what would you be cancelled for?",280,4,333
"Without being told explicitly, what’s the fastest way to tell, in the real world, that someone is a redditor?",277,1,329
"LGBT reddit, what are the funniest questions a straight person as asked you?",272,2,593
"People who have seen an objection at a wedding, what happened?",276,0,155
How can you confirm your dog isn't working for the NSA?,273,1,249
"If 2020 was a book, what sentence would it start with?",275,4,728
What's something that occurs once a year that you dread each and every time it comes around?,273,3,534
What's the most obvious hint you missed from a guy/girl?,270,5,433
How are you (lies only) ?,270,2,753
Where do you see yourself in 5 minutes?,271,6,588
What is your real life superpower?,268,6,662
What are your best tips for a new driver?,266,4,391
"Tattoo artists of reddit, what are some tattoos you’ve refused to do?",269,1,154
What part of a movie do you skip every time?,268,0,562
How do you cope with loneliness?,268,1,314
[Serious] what do you miss about being a child?,261,1,518
What do you want for your Birthday this year and why?,259,1,613
What becomes creepy if you're too good at it?,257,0,452
"If we say 'Bless you' when someone sneezes, what should we say 'Curse you' to?",258,2,252
What is something you know that most people don't?,264,0,638
What product will you NEVER buy BECAUSE of the advertisements for it?,257,0,659
What are the best examples of The Butterfly Effect?,258,3,278
"Women of Reddit, what makes you approach a guy?",260,4,383
How are you right now? Have anything you want to get off of your chest?,261,2,560
What’s an extremely creepy thing that’s widely accepted as ok?,257,4,754
"[Serious] Users of Reddit with Depression, what is something someone could do or say to help you, even just a little bit?",262,0,354
Who do you find attractive that most people do not?,254,0,556
What do you truly hate with a passion?,254,0,838
What fanbase do you think has the most toxic fans?,253,4,1100
Which dystopian science fiction novel do you think was most accurate to 2020?,252,5,241
What traumatized you as a child?,254,4,669
Which video game scares the shit out of you?,282,2,593
"can money really buy happiness, if so how?",254,2,535
What small thing that pisses you off immensely do you think no one else on Reddit would relate to?,253,6,744
What's something you will never do not even for all the money in the world?,253,5,382
What do you think when you look in the mirror?,251,6,562
"If you could crossbreed any two animals together, regardless of species, to create an entirely new animal, what would they be and what would it be called?",254,5,468
What're some seemingly insignificant things that could actually kill you?,247,0,472
If you could really sell your soul to the devil what would you sell it for?,248,1,539
You have 15 seconds left before you die. What are your last words?,246,5,555
what’s a great idea when said but not such a great idea when acted upon?,244,1,387
"If Reddit was secretly profiling everyone so the government could force you into labor camps, what job would they be assigning you?",241,4,304
Why do you like to be alive?,242,6,393
If you had 24 hours left to live what are you doing?,238,1,435
