Title,Upvotes,Time(military),# of Comments
"What if when you die, you find yourself in an alien body, holding a bong, around a bunch of aliens asking you ""How was it""?",1000,2,296
What are some things on this planet people don't appreciate enough?,1000,1,1000
What is the strangest Bible verse people probably don’t know about?,1000,5,1200
"Ex-prisoners of Reddit, what was the scariest thing you've seen on prison?",1000,1,680
What movie did you quit watching in the middle?,1000,4,2800
"Growing up poor, what was the simple thing you saw at someone's house that confirmed they were rich?",1000,6,1600
"Has a stranger ever pulled a Sherlock on you(as in, deduce a large amount of info about you from a minor detail), and how did they do it?",1000,2,659
What would your 13 year old self think of you now?,1000,3,1700
People of Reddit who actually love math....How?,1000,6,1200
"What screams ""I'm a poor but pretending to be rich"" ?",1000,6,1600
What is your recommended hangover cure?,1000,2,1600
"Without saying the name, what is your favorite video game?",1000,6,4200
What's a joke/quote/reference you make all the time for your own amusement since nobody else ever seems to get it?,1000,6,1600
What's the best way to show someone you love them?,1000,2,536
What is a good habit you have?,1000,1,1100
"What's your ""WE NEED TO LEAVE NOW!"" Moment?",1000,6,1000
"If Reddit had a war, which subreddit would win?",1000,3,760
Is suffering an important part of being human? Why? Or why not?,1000,4,737
Do you ever feel like your family is not even family but just people that are related to you by blood and if so why ?,1000,1,523
What lies do you tell yourself?,1000,1,1100
What’s the most useless fact you know?,1000,4,1600
What do you do at least three times a day?,1000,2,1700
What movie has made you laugh the hardest?,1000,3,1800
What massively used invention could you absolutely live without?,1000,0,1500
"Everyone, what are your tips for keeping a laptop in great condition?",1000,0,890
What's a little known survival fact that everyone should know?,1000,4,1500
How do you politely tell someone they are talking too much?,1000,4,619
2020 has been a pretty bad year by almost all standards. What is the best thing that has happened to you this year? What are you thankful for?,1000,1,1200
What things instantly make a person unlikable?,1000,3,1400
What’s an inanimate object that really shouldn’t piss you off as much as it does?,1000,1,1100
What's your favorite anti-happy-ending movie?,1000,4,1600
"Remember the 'boggart' from Harry Potter series. If you ever faced a boggart, what would it turn into, and what funny thing would you 'Ridikulus' it into ?",1000,5,505
"Health inspectors of Reddit, what are your horror stories?",1000,5,557
"[Serious] Redditors who have been homeless, what advice do you have for a 25-year-old who might find themselves in that situation very soon?",988,5,414
What historical figure was a horrible person despite everyone thinking they were great?,997,0,2000
[Serious] What's the thing you're most frustrated that you will miss because it will happen after you die?,984,3,1200
"People of reddit, what is the most cherished memory with your SO, that still makes you happy to be them?",982,0,316
"What was the classiest ""fuck you"" of history?",969,0,848
People who've been single for a long time: how do you deal with the lack of intimacy?,969,5,1100
Which one movie would you absolutely recommend to everyone?,965,4,1700
Who is the most annoying main character ever?,958,5,1900
[Serious] People of Reddit who have found out someone close to them was leading a double life - what was the story?,949,0,344
What has been normalised in society that really SHOULDN'T?,934,6,2000
What’s a mystery that will never be solved?,923,1,1700
"Women of reddit, what are some (unexpected) skills that make men attractive for you?",930,1,1200
What can you not believe you had to explain to an adult?,897,4,2100
What’s a movie you hate but everyone seems to love?,901,4,2600
What TV show made you genuinely cry?,894,2,2000
"Vegans of reddit, what is your stance on honey?",883,2,1500
What’s the worst way you ever seen someone fuckup a basic task?,887,4,1000
"Redditors, Whats a fact or truth everyone can agree upon?",875,5,1000
whats the worst time you've cracked up laughing?,864,0,686
"Night owls, what is the scariest thing you’ve experienced while everyone else was asleep?",861,3,763
"Redditors who have broken a bone, how did it happen?",851,0,1500
"People of this sub, why do you keep asking horny questions?",844,3,209
What heartwarming story do you have to share that could cheer up anyone on Reddit who’s feeling down right now?,841,3,250
Men of Reddit: What's something a woman can do to instantly melt your heart?,840,6,879
What's one thing that you HATE with a passion?,830,4,1900
What has been the most scariest moment of your life?,828,1,783
"If 2020 was a candy, what would it be?",809,3,1500
You discover a beautiful island where you decide to build a new society. What is the first rule you put in place?,744,0,928
"If prostitution was declared legal across the United States, what kind of marketing slogans do you think would be used for commercials?",749,2,553
"If you could ask your pet one question and get a 100% coherent and truthful answer, what would it be?",736,6,696
What is a secret that you don’t mind telling to 29 million anonymous people but not to people you know?,729,2,1200
What is the most fucked up song you have ever heard?,728,5,1400
"You suddenly wake up with one superpower of your choice. However, you can only use it for fifteen minutes after doing a good deed. What’s your superpower and what deeds do you do with it?",722,5,440
What is the dumbest Coronavirus theory you heard from someone?,705,5,905
"People of Reddit who work in ""haunted hotels,"" what are your stories?",704,5,258
What is worth dying for?,751,2,937
Did you ever dream about something and confused it as reality and lived with that false memory for years until you realized that you probably dreamed that? What was you false memory and how did you realize it?,694,4,315
"If you could increase the size of any animal to a rideable size, which animal would you choose?",688,2,986
[serious] Anxiety/depression sufferers: What are some ways you distract yourself to calm down/avoid spiralling?,679,3,887
What is a food combination that sounds disgusting in theory but is actually really delicious?,678,6,1500
You now have an alt account in real life. What do you do with it?,673,3,538
What do you miss the most about the early 2000s?,674,1,1200
What in your opinion is the creepiest mystery in the world?,674,5,673
What does Reddit have that other social media apps do not have?,671,2,848
"What piece of original media (movie, song, book) is already perfect and should never be remade?",673,1,1200
"If written like a news report, what stories from the bible were done by Florida man?",648,1,409
"People who just lay down and instantly go to sleep, how?",644,5,551
What is a stereotype about your country that is completely wrong?,644,0,1700
What’s never as good as people think it’s going to be?,643,6,937
"You died and are about to be reborn, would you like to be the opposite sex or same sex as before and you keep all of your previous memories. What would you choose and why?",641,5,772
"High Schoolers of Reddit: What is the biggest “Oh Shit, shits about to go down!” moment that you’ve experienced with either students, teachers, or even both?",1000,3,1100
Who’s your childhood celebrity crush?,635,1,1400
Your favourite movie is now backwards - what’s the plot?,635,4,873
What is the one thing you're good at?,619,3,1000
What song are you playing on repeat?,628,4,1400
What’s something that no longer exists but it’s something that you miss a lot?,616,4,1200
"If water is the default beverage, what’s the default food?",612,2,519
"[Serious] What are some difficult skills that you could become impressively good at over a weekend, ie you learn 60% of the skill in short amount of time but that last 40% can take years to master?",611,2,619
What was your workplace scandal?,612,4,617
What are some things only mentally ill people would understand? [serious],601,4,653
Parents of Reddit what is the most creepiest shit your kid has said or done?,605,6,522
What is something stupid you believed as a child?,596,4,1100
What would be put inside a mental health first aid kit?,591,3,655
"If someone asked you for a random music lyric, what’s the first one that comes to mind?",588,1,1800
"Swedes of Reddit, what is it like being able to read the names of things at IKEA?",588,6,257
what misconception annoys you?,587,4,1500
[Serious] Urban explorers whats the most scariest thing you've experienced while exploring ?,584,4,341
"Dear non norwegians, what do you think about norway?",587,4,1300
What’s something you’re extremely passionate about?,579,0,577
"People who keep their door unlocked at night, WHY?",573,6,739
"People who DON’T want children, why?",572,0,1600
What’s a common phrase you wished people stopped using?,573,3,1400
What songs do you have both the original and a cover of in your music library?,563,4,1300
What's something that happens in Real Life but never happens in Movies?,559,1,891
"People who grind in MMO's but avoid the grind IRL, why?",567,2,423
"Gay men, what’s a dead give away someone is gay but doesn’t know it yet?",562,5,593
"you can snap your fingers and one thing disappears forever ( you can only do it once )what person, place,thing or concept do you get rid of ?",558,1,1100
What subject did you absolutely hate in school?,548,3,1100
"As a kid what did you regularly eat or drink in secret, hoping no one would notice?",552,5,989
What's legal that you think shouldn't be?,551,5,1600
You come home to find every person you have slept with sitting there. How do you start the conversation?,554,0,1200
"What did your pet once do that made you go, ""hey, this guy is actually quite intelligent"" ?",534,2,572
How were you publicly humiliated by a teacher?,536,6,813
"[serious] people of reddit who live in small towns, what is the main creepy event or legend that happened in said small town?",530,3,492
Which tv series would you rate perfect 10 out of 10?,528,0,1900
"[Serious] ""If you aren't buying groceries, going to work or doing something essential to your survival, you shouldn't be out at all because of COVID"". What are your thoughts on this?",528,1,559
What do you collect?,517,3,1100
"It is said that for every human on earth there are 1.4million ants, supposed ant were to attack us how are you prepared to deal with your 1.4million?",519,0,505
What musical instrument would also make an effective weapon?,517,5,648
"You're stuck in a corner with a hord of zombies... the main characters from the last TV show you watched are there to save you. Who are they, and what is your outcome?",512,5,1400
What's your favourite film without saying the title?,518,2,1900
What is your dream job?,512,5,981
What is the most useless feature in Reddit?,507,2,519
What common parenting technique will actually really mess up your kids?,504,3,719
"Teachers of 2000’s, why all the hate toward Wikipedia?",499,5,299
What are some basic things that you can’t do?,499,5,1100
"Reddit, what are some skills that you absolutely need as an adult ?",495,5,417
Female ex-convicts - How are women prisoners who harmed a child (molested/killed/abused) treated in prison by other female prisoners? (SERIOUS),497,1,221
What's the worst ending you've seen in a book or a film?,496,6,1300
What is the most toxic social media site?,495,6,608
What real life plot holes have you noticed?,488,4,640
If 2020 was a alcoholic drink what would it be?,483,0,1400
What's your go to sad song?,476,1,1200
What is your username referencing?,472,5,2300
"What is the best way to deal with the overwhelming sense if dread, sorrow and pain that happens when being broke up with?",473,4,279
A cute friendly tiny homeless kitten comes up to you. What do you do?,467,0,713
What is a common cliche in movies or TV that really irritates you?,469,6,1100
"Gamers of reddit, what was your first video game?",460,1,1600
"Redditors who are no longer together with their first love, where are they now?",463,2,670
"people who don’t just click “agree” but actually read the policies of websites, what’s the most alarming thing you’ve found?",565,2,269
What is the most wholesome act of kindness you have ever experienced/seen?,462,4,209
"Men who ghosted women for seemingly “no reason”, what was actually your reason?",461,0,656
What’s the worst thing that happened to you that was a direct consequence of being lazy?,450,4,354
What do you prefer to dip your chicken nuggets in?,454,3,1000
r/askreddit Animators that animated a scene that became a meme: how do you feel about your accomplishment?,450,1,55
What popular dish do you find plain disgusting?,456,2,1600
What are some good Korean movies?,450,0,491
What’s the most unique item in your room right now?,450,1,1000
What are you secretly awesome at?,447,6,890
"Anxiety sufferers of Reddit, what are your go to non-medicinal ways of calming down?",445,5,597
What book was 100% amazing from start to finish?,443,2,1000
"Honestly, what is your wallpaper on your phone?",443,4,1400
What is the last pair of shoes you bought?,448,6,728
How would the world react to an actual Zombie Outbreak?,440,6,627
What is the scariest single sentence?,442,4,945
What is the funniest scene in a movie?,445,4,922
You come home to find your enemy's body on the floor. Everyone will suspect you did it. How do you hide the body?,444,0,560
"Anyone who's participated in a BLM protest, anywhere in the world; What really goes on, when the cameras aren't rolling?",439,3,315
Your Country is teleported to an alien planet for you to colonize. How well do you think your Country would do at colonising other planet?,435,3,631
Men of reddit: how does the compliment “you’re cute” make you feel?,432,2,740
"You discovered an asteroid, that could kill all life on Earth. How would you name it?",430,6,859
What do you hope is outside of the expanding universe?,433,4,503
"For the much older Redditors, what is something about kids' behavior today that would not have been tolerated when you were growing up?",426,2,724
What would be the worst thing about living forever?,438,2,776
"You were just gifted a cat, the last thing you ate is it’s name, what is it?",431,1,1900
"Girls, what pick up line was most successful on you?",425,0,446
What if we die and some guy pulls off VR goggles from our face and says “How was it?” how you would react?,423,6,325
What is the worst side effect from a medication that you've experienced?,423,4,1100
"For 10 seconds, stop what you’re doing and just listen. What do you hear?",423,5,1000
"If it was real, what would be the worst job from a video game?",418,5,409
[Serious] What are the worst human rights abuses currently going on around the world?,421,1,593
What’s a fate worse than death?,412,4,765
If you could replace any actor in an existing movie with Danny Devito which role would you put him in?,403,2,644
"If reincarnation is real, what would you like to become after your death?",406,0,862
What is something interesting about you?,400,5,789
"What’s the largest, most pointless and possibly confusing item under $50 you could buy online to have delivered to your friend’s house?",403,2,316
What is your favourite memory with your grandparents?,400,2,338
What happened to you that sounds fake but isn't?,400,0,623
Who is the worst game director and why?,401,5,374
What is the ONE thing you miss the most from the pre-Corona world?,398,6,865
What first name automatically makes you pre-judge?,396,0,1300
Your wedding is being planned by the cast of the last show you watched. Who’s planning your wedding?,389,1,1400
What do you think your pet has named you?,389,5,392
What is one item you didn't realise was so expensive as a kid?,388,5,576
"Without saying it’s name, what is your favourite game? How would you describe it?",386,4,1800
Why are you still alive?,385,3,1100
What are some small things that matter a lot?,384,4,463
What caused you to quit something you loved doing?,385,6,588
What is a bizarre phobia you have?,384,1,1100
What's your cure for boredom?,382,1,490
How do you think Covid-19 will change Halloween this year?,387,1,480
"Americans of Reddit, What are some questions you have for British people/Britain in general?",384,0,2900
What tiny thing instantly ruins your day when it happens?,388,2,669
What show/movie do you wish you had never watched? Why?,374,1,1100
To the person who sorted through new. How's your day going?,379,6,448
What historical figure is completely overrated and why?,375,4,922
"What is the best reply to ""Why are you so quiet?""",367,6,588
if 2020 was a game which one would it be?,372,4,787
What’s the tastiest damn thing you’ve ever eaten?,367,2,740
Who are you when nobody is watching?,368,1,543
What’s something you can get away with if you’re popular?,363,1,322
What made you happy today?,358,1,469
"Men/Boys of Reddit, what is your worst case of post nut clarity ?",363,1,507
What is your favorite video game OST?,360,5,850
What is the strangest conspiracy theory you've ever heard of?,362,4,748
What’s one positive thing that’s happened in your life because of COVID?,356,4,684
what is something that you just don't get about other human beings?,348,5,632
"You are approached by a frenzied scientist, who yells, ""I'm going to put my quantum harmonizer in your photonic resonation chamber!"" How do you respond?",346,2,382
"To those who 'followed you dreams', where are you now ?",350,6,342
What huge trend did we all forget about?,342,4,828
"Subway workers of reddit, what is the most disgusting sandwich you had to make?",340,4,288
"If you could replace the word ""Girl"" with the word ""Squirrel"" in any song title or lyric, what would the new version be?",346,0,580
"People of reddit, which one book, only one book do you think that every person on this planet should read before they die?",337,1,751
"People who quit their 9-5 job to follow their passion, what did you do and how did it turn out for you?",336,4,215
"If you could instantly travel inside any painting, what painting would you choose?",329,5,346
"Have you got a favourite word in English? If yes, what's the word?",336,4,1100
What are some simple questions with surprisingly complex answers?,330,6,665
"[serious] If you have a bad morning and you’re grumpy, how do you change your mood and have a better afternoon?",329,0,295
How do you cope with not really caring much about anything and not wanting to do anything and finding yourself staring at a monitor all day?,331,4,179
What’s the fastest way to make you angry?,329,1,863
"What’s a sign that a person is incredibly shy or socially anxious, but can get confused as being cold/rude?",321,0,204
What's the one thing you don't want to change post Covid-19?,327,1,654
"People who keep mass reposting the same 3 political questions on this sub, why?",321,1,70
Students of reddit what was the scariest shit you saw at school/locker room?,325,6,299
What are some of the benefits of being single?,320,6,523
What triggers you to start having a crush on someone?,322,1,422
What's your favorite thing about the house you grew up in?,325,1,415
"People who were born and raised in America who moved to another country, what have you learned?",323,5,364
What feels really dangerous but is completely safe?,320,6,425
We all gonna die one day. How do you overcome death fear?,321,6,682
"When someone returns a dish to you, do you rewash it, even if they say it's clean? Why or why not?",317,1,183
What is the best rock song of all-time?,321,1,931
"If you could give your pet 1 superpower, what would it be?",313,1,363
What is your country without saying its name?,310,2,2200
What song has been stuck in your head today?,314,0,892
Which celebrity or band has the worst fan base?,313,6,763
What's the weirdest dream you can remember having?,310,6,519
"Have you had any crushes on characters as a kid? If so, who were the weirdest ones?",307,4,656
"People who live alone, what would you do in case of a life threatening emergency (heart attack, choking on food, etc)?",306,4,366
"If you were given a device that could show you everyone who has ever had a crush on you without your knowledge, would you use it? Why or why not?",305,1,216
What makes you cry?,309,0,829
How do you make friends outside of school?,302,4,253
What is one thing that changed your life and that you’d recommend to everybody?,305,5,391
"When being interviewed for the career of your dreams, what’s the WORST thing you could say right off the bat?",297,2,292
"Redditors who work behind the scenes in the political government. What really goes on in your boardroom meetings that makes you think ‘’Yep, this is why no one trusts politicians’’?",299,5,127
What's something alot of people don't know is a scam?,300,2,702
"People who have dark senses of humor, what are some dark jokes that made you laugh?",301,3,487
The world is ending. What song is playing in the credits ?,302,6,834
You are going to make a hybrid of human and an animal. Which animal would you choose?,299,6,499
"People of reddit, what is one MAJOR problem with the current Gen Z and how can we solve it?",303,3,837
What cheese is best cheese?,296,2,649
Which Fictional Character is 100% too overpowerful?,298,0,863
What is your favourite accent?,296,2,760
Where else in life would upvote and downvote buttons be helpful?,290,4,245
How can you identify intelligent people?,294,5,495
The last two shows you watched are now combined. What is the resulting show about?,295,3,1000
"What is most childish thing, for your age, that you are still doing to this day?",296,4,560
"Have you ever misinterpreted a song lyric in a way sounds better than the actual song lyric? If so, what was it?",288,6,410
What TV show has the highest re-watchability factor?,296,6,708
What is something you want to get off your chest but don't have anyone to talk to about it?,290,0,680
What movie liked by nearly everyone do you hate?,295,0,1500
What would you do If you woke up and find out you’re in the beginning of 2020?,290,4,527
"Redditors, when did a teacher wrongfully punish you or your classmates?",286,0,3
"Redditors that can lucid dream frequently and on purpose, what tips do you have for beginners trying to learn how?",287,4,172
What 'Life Pro Tip' has actually improved your life?,287,1,320
"You have to play only one game for 24 hours straight for 1 million in your local currency, what game do you play?",287,4,955
What song has been your jam recently?,280,6,739
"Straight men of reddit, who's one guy who you see and always think 'Damn, that's one good looking man'?",282,5,684
"What ""life minigames"" (like stopping the microwave right before zero) do you like to play?",282,6,323
"What's a video game you ended up so deep in the side quests, you never actually completed the main game?",281,5,347
"Amish people who’ve joined the modern times, do you miss it? What happened to make you leave?",280,6,99
"If your entire life was revealed to the internet, what would you be cancelled for?",283,4,333
What are some movies where the bad guys win?,284,2,694
How rich are you?,279,3,763
"Without being told explicitly, what’s the fastest way to tell, in the real world, that someone is a redditor?",280,1,330
What's the earliest memory you have?,274,5,551
"If 2020 was a book, what sentence would it start with?",274,2,729
"People who have seen an objection at a wedding, what happened?",271,0,156
What’s the best thing about having a best friend of the opposite gender?,273,6,271
Who’s a mostly well-liked fictional character that actually kind of sucks?,271,4,964
"People who don't play videogames, what do you do in your free time?",268,2,325
How are you (lies only) ?,270,2,754
Where do you see yourself in 5 minutes?,269,6,590
What's the coolest thing you own?,264,0,590
What’s the cruelest thing that’s ever been said to you?,266,0,765
What are your best tips for a new driver?,268,4,392
(Serious) What's a natural occurrence that still amazes you?,263,1,389
"Men of Reddit , how do you know when a relationship isn’t working ?",268,0,293
What are the best comebacks to *you're fucking ugly*?,261,4,574
"People of Reddit, what is a common behavior on Reddit that really annoys you?",268,4,772
What part of a movie do you skip every time?,269,0,565
What becomes creepy if you're too good at it?,261,0,451
"If we say 'Bless you' when someone sneezes, what should we say 'Curse you' to?",259,2,254
What is something you know that most people don't?,261,0,640
"[Serious] Suicidal redditors, what's keeping you from ending it all?",260,5,669
What’s the most illegal thing you’ve done?,260,4,551
[Serious] what do you miss about being a child?,264,0,521
How are you right now? Have anything you want to get off of your chest?,262,1,561
"Women of Reddit, what makes you approach a guy?",261,4,385
What’s the best name for a cat you’ve ever heard of?,255,2,710
"[Serious] People of Reddit, what revelation changed your life forever?",255,6,321
What movie actors do you think were absolutely perfect for their role?,258,4,737
What is something you were once very insecure about but feel the complete opposite now?,258,4,330
How do you cope with loneliness?,257,1,313
What do you truly hate with a passion?,257,0,840
What fanbase do you think has the most toxic fans?,258,3,1100
