Title,Upvotes,Time(military),# of Comments
It's more than likely that Covid-19 will still be around at Christmas time - how are we going to explain to kids that Santa is still allowed to go into millions of houses?,137000,3,15400
"How would you feel if the U.S. government made the day for voting, a holiday?",102000,1,10700
"What do you KNOW is true without evidence? What are you certain of, right down to your bones, without proof?",98000,1,52100
What's your favorite poverty meal that you still eat regardless of where you are financially?,94000,6,40400
"If you got offered $1,000,000 but it meant that every traffic light you approach will be red, would you take it? Why or why not?",91000,2,15000
"[Serious] People of reddit who have gone through or are going through cancer, what was the first sign that made you go to the doctor?",90000,6,15700
"300-400 years ago, pirates were a terrifying force to be reckoned with. Now they’re family friendly figures of fun. What will be their modern day equivalent a few centuries from now?",89000,6,10500
What is the greatest comeback to a insult you’ve ever heard?,88000,5,17000
"If you voted for Donald Trump in 2016 but won't in 2020, what changed your mind?",87000,0,28200
"What video or recording is perfectly innocent, but becomes terrifying when you look into the story behind it?",85000,4,24900
"If Covid never happened, what all would've you done in on past 4 months?",80000,4,33600
Postal Workers of Reddit: What do you need right now? How can we brighten your day when we see you on our routes?,78000,0,5200
"Do bosses like Michael Scott actually exist? And if you work/ed for one, what's your craziest story?",77000,3,7000
"If you could singlehandedly choose ANYONE (alive, dead, or fictional character) to be the next President of the United States, who would you choose and why?",77000,1,33400
What has your pet accidentally conditioned you to do?,76000,0,11400
What are you STILL salty about?,76000,0,42100
What’s the most overpriced thing you’ve seen?,74000,4,36700
[Serious] How would you react if the US government decided that The American Imperial units will be replaced by the metric system?,72000,6,14800
"Redditors who were born at a very young age, what is your story?",71000,4,8400
What small thing brightens your day?,71000,5,16100
"Men and women of reddit who caught their significant others cheating, how did you do that? And what was your reaction?",71000,5,15300
Which type of tattoo makes you cringe the most?,70000,2,27800
"Guys, what made you realize, “this girl is definitely not into me”?",66000,2,20600
"What is your ""I was into X before it was cool"" thing?",65000,2,29900
What is just a placebo effect but most people don't realize?,64000,5,21500
"[Serious] People that do autopsies, whats the weirdest thing that you have found that didn't have anything to do with the person's death?",64000,4,12200
What have you accidentally conditioned your pet to do?,63000,0,13200
How do you get over someone?,61000,1,10300
"What is the single worst movie you sat through hoping it would get better, but didn’t?",61000,4,47400
"How does the compliment ""you're smart"" make you feel?",59000,2,15500
"Women of Reddit, what things that men find unattractive about themselves do you find very attractive, and why?",59000,6,17100
What is one thing that instantly makes you think “this person has no manners”?,59000,6,20700
"Are you afraid of dying? If so, why?",58000,0,23400
"If there was one movie you could completely delete from reality, what would it be?",58000,1,28400
What non-sexual thing feels very sexual?,57000,2,23200
Those who grew up with a good father. What was the most important thing you learned from him?,56000,1,11800
What's the dumbest thing you've ever heard someone say?,55000,3,31600
What is a useless talent you have?,55000,4,32100
What are you happy about right now?,55000,3,24200
"Nietzsche once wrote, ""He who has a why to live can bear almost any how."" What is your why?",55000,3,7900
What scene in a movie really pissed you off?,54000,4,29100
What has no right to be as difficult as it is?,53000,3,22100
What do we continue to use after it is broken?,53000,6,23500
What advice would you give to a 14 year old about starting high school?,51000,5,14400
What is the worst notification you have received whilst someone else has had your phone?,51000,6,7100
"It turns out the media was right! Video games do cause violence. Based on the last game you played, what are you getting arrested for?",51000,2,38300
What Video Game was 100% amazing from start to finish?,51000,2,45300
"[Serious] People who like their job, what do you do?",50000,2,17000
Which song is playing on a loop in the lowest pit of hell to further torment the damned?,50000,2,20600
"If you could change the color of one thing in the natural world, what would it be?",49000,4,13400
You are now one inch taller. How does this affect your life?,48000,4,18000
What's something that was designed for the use of one sex but is now predominantly used by the other?,48000,1,10200
Users of reddit what is the worst thing your teacher has ever said in front of a class?,47000,3,16500
What animal could just wipe out the entire human race if they were fed up with us?,46000,2,11200
"What's the greatest, worst movie?",45000,5,17800
"(Serious) People who recovered from COVID-19, what was it like?",45000,3,7100
Marriage counselors of reddit. What’s the stupidest reason a couple has made an appointment?,45000,2,9900
"Americans, when you travel from state to state, do you feel culture shock or do you feel like it's sort of the same culture, and why?",44000,4,12400
What do you do with that white ball after drinking mozzarella?,44000,4,2500
What do you envy about the opposite sex?,47000,2,25700
"Without taking any objects with you, how could you impress a caveman?",43000,4,9500
"Describing it as a crime, what do you do for a living?",42000,4,15000
What's something you wish you started doing earlier in life?,40000,1,10800
If you saw yourself getting sold on dark web and you decided to buy yourself. How do you think they'd deliver you to you ?,39000,4,3100
Why did that teacher get fired from your school?,38000,4,19000
What is something YouTubers do that annoys the crap out of you?,38000,3,16000
Has your class ever made the teacher cry? What happened?,37000,4,9100
"People with same sex parents, how do you save them on your contacts?",36000,4,4900
(Serious) What mysteries from the early days of the internet are still unsolved to this day?,36000,6,9600
"If you could enlarge one thing about your body, what would you embiggen? Conversely, if you could ensmallen one thing about your body, what would you debigulate?",36000,3,7700
"If you got offered $1,000,000 USD but every time you spend it you hiccup for every dollar you spend, would you take it? Why or why not?",35000,6,4500
"Using Donald Trump's way of speaking, how would you describe your day?",35000,5,3700
What new hobbies have you picked up this year and would you recommend them to others?,35000,5,11100
What are the most cowardly things a person can do?,35000,0,9700
How’s your mental health doing right now?,52000,3,19800
"[Serious] Firefighters of Reddit, what are some ways to help keep pets safe if there's a fire, especially if the owners aren't home?",34000,0,2000
What is the most disgusting secret you're hiding right now?,34000,1,16900
"[Serious] What are some ways one can stop unwanted ""what if"" anxiety-inducing thoughts from spinning in their head?",31000,0,2600
"Reddit, whats your “Anyways, we’re married now” story?",30000,3,7000
What is your favorite animated TV show?,30000,5,16000
What's your favorite webcomic?,29000,0,7300
"[Serious] People who did a long time (5 years+) in prison, what was your biggest shock of the outside world?",28000,3,4600
What's the lamest way that you injured yourself badly?,26000,4,162
What compliment do you still remember being given?,26000,3,9700
What annoys you most about celebrities and why?,25000,4,7200
"Without saying what you did, why did you do it?",24000,5,11300
What place gets creepy when you're alone?,23000,5,6700
[Serious] What tip or piece of advice do you constantly see that you strongly disagree with?,22000,1,7700
"Virtual Teachers of Reddit (Due to COVID-19), was it shocking to see how some of your kids actually live? And if so, what was the most extreme story?",21000,3,4000
"Minorities of reddit, what experience was so unbelievably racist, to the point where you weren't even mad, but just... Confused?",21000,6,7800
What's a movie you wish you saw in theaters?,20000,0,11100
Which fictional characters do you find both very attractive and overpowerful?,20000,3,8600
"What is your favorite ""so bad it's good"" movie?",19000,3,138
"What’s your best ‘but wait, it gets worse’ story?",19000,3,5100
"Non-Binary people of reddit, what is your preferred number system?",19000,6,1900
What's a secret you can only share with online strangers?,18000,1,109
"Without naming your respective country, what is it known for?",18000,0,284
Which subreddit was so toxic that you left and don’t regret it?,17000,2,115
"At 2:32pm, your dog walked into your room, stared at you point blank, and said “nobody will ever believe you” before walking out. How do you react?",17000,3,2900
Hogwarts is closed for COVID. What remote learning alternatives are there for wizards and witches?,17000,1,1800
Have you ever witnessed a genuinely nice person get backstabbed for no apparent reason? What happened?,16000,4,2400
What is the worst thing you’ve ever seen someone do at a funeral?,15000,3,5500
What screams “I’m way richer than I look”?,15000,5,6400
What would you be doing right now if you didn't follow your moral compass?,15000,2,5200
What is a scam not many people notice?,14000,5,7800
"It is 1693 in Salem, Massachusetts and you've just been accused of being a witch. How do you prove your innocence?",14000,5,2800
You will be given 10 million dollars in cash if you manage to cross the Pacific Ocean (California - Philippines) alive with a regular yacht and 3 months worth of food. Would you take the challenge? How would you do it?,14000,4,2500
"Interstate rest area and truck stop employees, what’s the most bizarre story you have?",13000,0,2200
"People that have played video games for extended periods, have you ever felt like you were still in the game even after you have stopped? If so, what happened?",13000,6,4400
What gender double standard really annoys you ?,13000,5,113
What is a sign of low intelligence?,13000,0,7600
What is something you quit as a kid and now wish you continued?,12000,4,4800
What are examples of toxic femininity?,12000,4,6200
People with disabilities: what’s one thing you wish everybody knew not to say? [serious],12000,4,5000
"Former suicidal people, why did you choose to live? (SERIOUS)",11000,1,6000
What is so stupid but it actually really works?,11000,0,4500
What's the best song to play while having explosive diarrhea?,11000,2,3400
"Happy International Left-handers Day! To all the lefties in the world, what sets you apart from your right-handed counterparts?",11000,3,3300
It's 2052. Teens are romanticizing the year 2020 on a popular app. What do their videos look like?,11000,5,1400
What sounds offensive but actually isn’t?,11000,5,5200
What's something you've done your whole life but are still bad at?,11000,1,5100
You get $100 for every person you can bore to sleep with a lecture. What topic would you pick and what would you talk about?,11000,1,3700
What is the greatest G-rated insult you've ever heard?,10000,2,3800
What was something you did as a kid that you thought was badass but as an adult you find cringy?,10000,1,4400
"You're not a serial killer, but a cereal killer. Which cereal do you want to get rid of and why?",10000,1,3500
How do you piss off an entire fandom?,10000,5,9100
"Disabled/Chronically Ill Redditors, what's the worst piece of advice someone has given you to ""cure"" your illness/disability?",11000,2,5500
People who vocalize their yawns: Why?,9000,3,2200
What is the best show that was canceled after just one season?,9000,3,8600
"Night shifters, ever witnessed a paranormal activity? If so, what was it?",9000,2,2800
What do kids with helicopter parents look like as adults?,9000,1,2200
Which Film was 100% amazing from start to finish?,8000,1,8500
"You can delete 1 app or game out of existence, what will you delete?",8000,6,5500
What is the worst text message you could wake up to?,8000,0,3200
What’s the coolest thing your wife’s boyfriend has ever let you do?,8000,5,1100
What’s something that a lot of people are missing out on because they don’t know about it?,8000,1,3800
"People of Reddit, do you ever ignore text messages of your friends or family for no apparent reason? Why or why not?",8000,3,2400
"60 y/o and older, what is your biggest ""should have done that differently"" in life? What's the better way?",8000,4,2000
"Redditors who have been in such severe and enduring physical pain that they honestly would have clicked an 'insta-death' button, what was the cause of your pain?",8000,6,4400
"Therapists of Reddit, have you ever been genuinely scared of a patient and why?",8000,6,1500
"What was the moment where you thought, ""I'm getting old""?",8000,6,6100
What do you guys miss from the 2000-2009 internet?,7000,3,4700
What should be humanity's goal?,7000,6,3200
"If you were a serial killer, what would be your signature thing that you’d leave at every crime scene?",7000,1,4500
how would you compete against someone with a near infinite amount of money?,7000,5,1800
"British people of reddit, what is the most british insult you can think of?",7000,5,3600
"USPS employees, what madness is happening at your place of employment currently?",7000,5,1000
How did you get that scar?,7000,5,6500
"People who’ve had a “Something is VERY wrong here and I need to leave” feeling but stayed, what happened?",7000,6,2600
What are teens doing on the internet that adults have no idea about?,7000,2,3400
Which person from real life would be able to lift Thor's hammer?,7000,4,3200
"[Serious] Autistic people of Reddit, what is a social norm that you've just recently found out about?",7000,6,3400
Men of Reddit what’s something women obsess over because they think you like it or they’re trying to impress you but you really couldn’t care less about?,7000,0,4500
"What songs upon first listen seem like normal songs, but totally change the mood and meaning when you understand the lyrics?",6000,0,5300
What’s the worse pain you’ve ever felt?,6000,1,7000
"If Ms. Frizzle was a real person, what charges would she face in the court of law?",6000,5,883
What Ficticious creature would help the world most if it existed?,6000,2,3000
"Window cleaners of Reddit, what are your stories you witnessed on the job?",6000,2,889
"Men of Reddit, what do you actually want your girlfriend to get you as a gift?",6000,0,3200
You are immortal and locked in a room for 100 years with no need to drink or eat. You are allowed to use a computer with only one website for the whole 100 years. What website would you choose?,6000,6,2400
What should we learn from this COVID-19 pandemic?,6000,3,3900
"Non-americans who moved to the US, what are some social customs that have been the hardest for you to get used to?",6000,2,5700
Men of Reddit: how would you feel if you were given flowers as a gift from your girlfriend/significant other?,6000,2,2300
"What could the USA have spent $1,900,000,000,000 on instead of invading Iraq?",6000,1,2700
What are some of the best lyrics you’ve heard?,6000,4,6400
"People who read the Terms and Conditions of things, what weird things did you see?",6000,4,1200
What are some dark facts about cartoon shows?,5000,3,3400
"Deaf people, what goes through your mind when you see noise subtitles that are generic or you have never experienced?",5000,2,478
What do you truly not give a fuck about?,5000,4,4300
What are some “plot holes” in you religion?,5000,5,4900
For those of you who have been to prison/jail what is it like?,5000,4,1600
"Men of Reddit, what things that women find unattractive about themselves do you find very attractive, and why?",5000,5,3300
"Writers of reddit, what is your favorite story concept that you'll never actually write?",5000,0,1900
"If alcohol is a “social lubricant”, what would you consider a social contraceptive?",5000,5,2500
What legal thing are you addicted to?,5000,6,3800
"Girls, what’s the most obvious “I like you” hint you gave a guy, but for some reason they still didn’t get it?",5000,2,3100
[Serious] What is something that most people don't realize is anti-poor?,5000,1,3900
"How do you stop the ""Most humans suck"" mentality?",4000,4,1900
"Of all the games you played, which had the best soundtrack?",4000,4,7100
What's something you've been dying to say but had no one to tell?,4000,1,3100
"If condom wrappers had inspirational quotes on the inside, what would be some good ones?",4000,0,1500
What’s invisible but you wish people could see?,4000,4,2700
What is cool if you’re handsome but creepy if you’re ugly?,4000,1,2500
What do you add to enhance Mac and Cheese?,4000,4,3300
What song has not aged well?,4000,5,3900
"Teenagers of Reddit, What are the hardest things to explain to adults that you can tell a child and will understand?",4000,6,3200
What things IRL should be nerfed?,4000,4,2700
What does Hollywood get wrong about your home country?,4000,5,3900
"Your username is the cure to the coronavirus, what is it?",4000,2,7700
"If you did not vote for Donald Trump in 2016 but will be in 2020, what is your reason?",4000,0,8200
What would be the most inefficient way to organise books in a library?,4000,1,2500
What do/did you hate the most about school?,4000,6,4000
"People who brush their teeth in the shower, what do you do with your spare time?",4000,0,1200
"Jeff's of the world, how do you feel about Geoff's?",4000,3,831
"Based on nothing more than pure speculation, which Celebrity do you think has the worst breath?",4000,0,2000
"Harry Potter is nearing middle age, and wizard or not, has to deal with the banalities of adulthood, what are the names of some of his later books?",3000,6,1800
What is something you don't understand about humanity?,3000,4,2600
What’s something that makes you instantly dislike a person?,3000,6,3000
What was something that happened in your school that caused a rule to be made?,3000,1,2600
[Serious] What are some Cryptid/Ghost/Unexplained stories you'd be willing to share?,3000,0,1800
"Non-Americans of reddit who visited the United States, what was the weirdest (or shocking) thing you saw?",3000,4,6400
What is the most terrifying fact?,3000,1,3300
"Atheists of reddit, what religion makes the most sense?",3000,4,3300
"If Pokemon where real,which one would be the most terrifying?",3000,2,2300
"Teachers of reddit, what is the stupidest reason a kid has told on someone else?",3000,2,1400
What was the reason for your break up?,3000,1,2900
"Doctors of Reddit, what is it like when you go to the Doctor’s?",3000,6,412
What would be your first words if you were the first person to step on the Mars?,3000,4,2800
"Men, what made you cry?",3000,4,3300
"Non-religious people of reddit, what do you think happens after you die?",3000,5,3000
"If you were in Avatar the Last Airbender, which of the 4 elements (water, earth, fire, air) would you want to control and why?",3000,3,2100
What is the one thing you realized during this pandemic?,2000,0,3000
"If someone offered you $1 million per year to never again drink alcohol, smoke cigarettes or marijuana, or use any sort of illegal drugs, which would you be willing to accept and what is the reasoning behind your decisions?",2000,1,2600
"What did you just recently learn that ""everybody knows""?",2000,4,4000
"If humans had a XP bar, what would increase XP and who would have the highest XP in the world ?",2000,2,1100
What is one really annoying thing that almost everyone does?,2000,4,2400
What cool things could we do with America's dead/abandoned shopping malls?,2000,1,1800
What is the least attractive name?,2000,5,4200
"LGBT+ members of Reddit, What is your worst “I’m not a homophobe but” story?",2000,1,2300
"What's a strange, but true fact about the human body?",2000,0,2600
"How would you feel about a voting system where Presidential candidates registered their position on a wide range of issues and instead of voting for a person, you voted on those issues and the system would assign your vote to the candidate best matching your priorities?",2000,3,602
Would you ever want to live in those quiet rural Japanese towns you see in anime? Why or why not?,2000,5,962
What is the biggest thing you did but never got recognized for?,2000,6,1100
Make-A-Wish Workers what's the weirdest request you have gotten?,2000,1,667
"Girls of reddit what are the most obvious hints you've ever given a guy, and he didn't get it?",2000,1,2000
"If America had a Mecca, a place where every American must go at least once in their lifetime, where would it be?",2000,0,2100
How do you get over a girl?,2000,0,1600
"Introverts, how did you meet your girlfriend?",2000,3,1700
What was the most bizzare school rule you had in your school?,2000,0,2700
What’s a good source for unbiased journalism?,2000,4,1600
You have hacked Donald Trump’s Twitter profile. What’s the most damaging single tweet you could possibly send?,3000,2,2900
What were you known for in high/middle school?,2000,0,2000
What always feels amazing?,2000,1,2000
What is another reason you like wearing a mask in public?,2000,1,2100
What makes someone instantly likeable?,2000,2,954
What do you regret doing in a dare?,2000,2,1100
"What is the worst feeling, emotionally, in your opinion?",2000,1,1700
"What was your ""this is it, I'm probably gonna die"" moment?",2000,0,1400
What is something that the world thinks is cool if you're a guy and not cool if you're a girl?,2000,2,1800
What are some interesting questions to ask on a 1st date?,2000,3,1200
What do you think is the most overrated movie ever?,2000,4,4400
What three seemingly harmless words sound really creepy together?,2000,3,1500
What strange trait is very attractive to you?,2000,6,2000
What famous picture actually has a disturbing backstory behind it?,2000,1,989
You’re in a public bathroom and someone knocks. What’s the most awkward thing you can say?,1000,5,1500
What is the absolute worst way to die?,1000,0,2300
"You wake up in god mode only for 24 hours, what are you going to do?",1000,2,1700
"If Nintendo called you up and said ""Hey, we outta ideas for new dlc characters for smash, so we're just calling up random numbers to see who they think should get in the game. Who you want?"" What would you tell them?",1000,5,2000
Whats a terrifying fact that keeps you up at night?,1000,5,1600
"Men of Reddit, what‘s the most ""girly"" thing you do on a regular basis?",1000,5,2300
What are some strangely specific subreddits that most people don't know exist?,1000,2,990
Which saying do you disagree with?,1000,3,2600
"Add “and Hitler” to the end of the title of a book, movie, or TV show. What is it about now?",1000,4,3100
What can kill you in a LITERAL split-second?,1000,6,1600
"Like tongue twisters, what are some finger twisters in sign language?",1000,6,206
"Women, what do you not understand about men?",1000,5,4700
How is the U.K viewed by the rest of the world?,1000,1,3100
What will be 2020's final boss?,1000,4,2200
"Kids will ask, ""What was a payphone, or what was cassette?"" What will someone, 15 years in the future, ask, ""What was (blank)?""",1000,4,1800
"[Serious] People of Reddit who have killed or hurt someone badly, what is your story? Do you regret it?",1000,2,846
"What game gave you so much paranoia, that you deleted or stopped playing the game?",1000,2,1500
"People who have never been able to see, what's your definition of beauty?",1000,2,351
"People who've been in psych wards, what was your experience?",1000,2,892
What is a song everyone should know by memory?,1000,3,2300
"Redditors that voted Democrat in 2016 but won’t in 2020, what changed your mind?",1000,0,1600
What is a little fact about your pet?,1000,5,2000
What mystery was never solved?,1000,4,1900
"The world now runs on video game logic, what's the first thing you do?",1000,5,2000
What’s one thing you deeply regret?,1000,2,1400
Whats the most embarrassing way to die?,1000,3,1300
What dark videogame moment are you still trying to get over?,1000,5,2300
"Elon Musk said that AI is already better than humans in all, if not most, activities, what activity will AI never match humans?",1000,0,1700
What is the most creative insult you ever heard?,1000,4,1300
what’s a song that you could kick someone’s ass to?,1000,3,2400
What simple “life hack” should everyone know?,67000,3,208
"If Kirby absorbed you, what skill would he get?",1000,1,1800
What exists just to make life hard?,1000,4,1600
"What’s the worst way of dying, in terms of pain?",1000,4,1600
"Women of Reddit, what is the hardest thing to explain to a man?",1000,5,2600
What’s the one song you listen to but don’t feel comfortable with others knowing you listen to it?,1000,5,1500
"You can permanently remove 1 thing from the internet, what is it?",1000,2,2100
What borders on stupidity?,1000,0,1000
"[Serious] After spending time in a foreign country, whats something you learned that you took back to your home country?",1000,2,1600
"Without saying their name, who’s your favorite singer/band?",1000,1,4300
