Title,Upvotes,Time(military),# of Comments
"Teachers of reddit, what are some shocking things schools do to save money most people don’t know about?",252,6,160
Which dystopian science fiction novel do you think was most accurate to 2020?,251,5,241
What’s an extremely creepy thing that’s widely accepted as ok?,254,4,762
What do you hate being called?,256,5,735
What is a song in non-English language that you think everybody will like?,250,6,619
What's the best way to get out of a situation where someone won't stop talking and you just want to leave?,255,4,304
"Steve Irwin has you pinned down in a headlock, what cool facts does he tell the audience about you and your habitat?",129000,2,5100
What's your favorite poverty meal that you still eat regardless of where you are financially?,95000,6,40400
"IF people used ""break up lines"" instead of ""pick up lines"" what would some of them be??",91000,1,10300
"300-400 years ago, pirates were a terrifying force to be reckoned with. Now they’re family friendly figures of fun. What will be their modern day equivalent a few centuries from now?",90000,6,10500
What old video games do you still play regularly?,85000,0,59600
Postal Workers of Reddit: What do you need right now? How can we brighten your day when we see you on our routes?,79000,1,5200
what invention is so good that it actually can’t be improved upon?,78000,4,20900
What’s an industry secret in the field you work in?,78000,0,37500
"If you could singlehandedly choose ANYONE (alive, dead, or fictional character) to be the next President of the United States, who would you choose and why?",77000,1,33400
What are you STILL salty about?,77000,0,41900
What has your pet accidentally conditioned you to do?,77000,0,11400
What are some free/low-cost resources college students should know about?,75000,6,6600
What’s the most overpriced thing you’ve seen?,74000,4,36600
In 40 years what will people be nostalgic for?,73000,5,18400
What movie could have been over in 10 minutes if the main character wasn't such a fool?,73000,3,23000
What small thing brightens your day?,71000,5,16100
Which type of tattoo makes you cringe the most?,71000,2,27700
What did a crush do that made you instantly lose interest in him/her?,71000,5,27100
"Men and women of reddit who caught their significant others cheating, how did you do that? And what was your reaction?",71000,5,15300
Reddittors who were born deaf; do subtitles like “dogs barking” and “tense music” help even if you’ve never heard them? What do you imagine them to be like?,71000,0,3300
What Movie Will You Always Recommend To People?,70000,6,41400
What simple “life hack” should everyone know?,68000,3,20900
"You get $5,000,000 USD, but for every two weeks you are alive for, a tastebud grows in your butthole. Would you take it? Why or why not?",67000,1,5800
"Guys, what made you realize, “this girl is definitely not into me”?",66000,2,20500
"Students/Teachers of Reddit, what’s the best ‘forgot to turn off the mic’ story during virtual learning?",67000,6,8100
"What is your ""I was into X before it was cool"" thing?",65000,2,29800
"[Serious] People that do autopsies, whats the weirdest thing that you have found that didn't have anything to do with the person's death?",64000,4,12200
What have you accidentally conditioned your pet to do?,63000,0,13200
"Garbagemen if reddit, what are your pet peeves about all of us? What can we do to make your job better?",64000,1,5800
"Kids born to teen mom's, how different is your life compared to other kids?",63000,4,7100
"Where can you find fair, honest and reasonably unbiased opinions on world news and politics?",62000,2,13400
How would you feel about a button that filters out all political sub reddits on the popular or /r/all page?,62000,4,4100
How do you get over someone?,61000,1,10200
"Women of Reddit, what things that men find unattractive about themselves do you find very attractive, and why?",59000,6,17000
What non-sexual fantasies do you have?,59000,0,25200
"If there was one movie you could completely delete from reality, what would it be?",58000,1,28300
"Non-Americans of reddit, what is your genuine reaction to what’s going on in America right now?",57000,0,29700
How did you turn your life around?,56000,6,12900
What are you happy about right now?,55000,3,24100
"Nietzsche once wrote, ""He who has a why to live can bear almost any how."" What is your why?",55000,4,7800
What scene in a movie really pissed you off?,54000,4,29000
What has no right to be as difficult as it is?,54000,4,22000
"When you're lying in bed at night, do you ever randomly remember some relatively minor social missteps or poorly chosen words you did/said years earlier? And then beat yourself up over it even though it really wasn't a big deal? If so, what happened?",53000,2,4000
How’s your mental health doing right now?,53000,3,19600
"If 2020 had its own museum, what might one buy in the gift shop?",53000,4,12100
What reddit culture is so annoying or straight up fucked up ?,52000,6,19400
"It turns out the media was right! Video games do cause violence. Based on the last game you played, what are you getting arrested for?",51000,2,38300
Which song is playing on a loop in the lowest pit of hell to further torment the damned?,50000,2,20600
What's something that was designed for the use of one sex but is now predominantly used by the other?,48000,1,10200
What do you envy about the opposite sex?,47000,2,25800
"What's the greatest, worst movie?",45000,5,17800
"Albert Einstein once predicted that under a capitalist society, parties and politicians would be corrupted by financial contributions made by owners of large capital amounts, and the system cannot be checked even by a democratic society, how accurate is his statement in regards to your country?",45000,3,4300
Marriage counselors of reddit. What’s the stupidest reason a couple has made an appointment?,45000,2,9800
"People of reddit, have you ever done anything, ever? If so how was it?",44000,2,6700
What is your all time favourite Episode from any TV show?,43000,4,25700
"Without taking any objects with you, how could you impress a caveman?",43000,4,9500
"People of Reddit, what terrible path in life no one should ever take? [SERIOUS]",41000,0,12000
"Every time someone lies to you, $100 gets deposited to your bank account. What is the fastest way for you to get rich?",40000,4,18200
What only exists to fuck with us?,40000,1,16200
What makes you sad always?,40000,2,17200
You're suddenly killed and Death lets you choose a game to challenge them for another chance at life. What game do you choose?,38000,4,14600
What are you sick of explaining?,38000,3,30800
Why did that teacher get fired from your school?,38000,4,19000
Has your class ever made the teacher cry? What happened?,37000,4,9000
What's the best way to tell your friend you don't want to meet because you're scared of Corona?,37000,5,4800
(Serious) What mysteries from the early days of the internet are still unsolved to this day?,36000,0,9700
"What is your favourite, very creepy fact?",36000,3,16500
"If you could enlarge one thing about your body, what would you embiggen? Conversely, if you could ensmallen one thing about your body, what would you debigulate?",36000,3,7600
What new hobbies have you picked up this year and would you recommend them to others?,35000,5,11100
What is the most disgusting secret you're hiding right now?,34000,1,16900
"[Serious] What are some ways one can stop unwanted ""what if"" anxiety-inducing thoughts from spinning in their head?",31000,0,2600
What video game had the most potential but failed completely?,31000,2,21300
"Reddit, whats your “Anyways, we’re married now” story?",30000,4,6900
What is your favorite animated TV show?,30000,5,16000
"[Serious] People who did a long time (5 years+) in prison, what was your biggest shock of the outside world?",28000,3,4600
What feels rude but actually isn’t?,27000,0,9000
What's the lamest way that you injured yourself badly?,26000,4,16100
What critically acclaimed video game did you just not care for?,26000,6,20500
What annoys you most about celebrities and why?,25000,4,7200
Dear Redditors who ended a relationship with their best friend. What was your breaking point?,25000,2,8700
What makes you happy?,24000,2,8500
What's the best way to make a grilled cheese sandwich?,23000,0,4900
"Bisexual people of Reddit, how does your taste in men compare to your taste in women? Are you attracted to similar traits in both genders or do you look for completely different things?",23000,1,4500
[Serious] What tip or piece of advice do you constantly see that you strongly disagree with?,22000,1,7600
Who is an actor that played a villain so well that you still hate the actor?,22000,1,12000
"What are some legendary Reddit tales, that newbie Redditors may not have heard yet?",22000,2,4500
"Virtual Teachers of Reddit (Due to COVID-19), was it shocking to see how some of your kids actually live? And if so, what was the most extreme story?",21000,4,4000
"Deep sea Divers, what are your horror stories?",32000,3,4000
What's a movie you wish you saw in theaters?,20000,0,11000
What are your thoughts on kissing the homies goodnight?,20000,0,2200
"Art teachers of Reddit, what’s you “Draw anything you want” story?",19000,5,2400
"What is your favorite ""so bad it's good"" movie?",19000,3,13800
"Non-Binary people of reddit, what is your preferred number system?",19000,6,1900
What's a secret you can only share with online strangers?,18000,1,10900
What is a nonconfrontational way to tell someone that their mask should cover their nose too?,18000,5,4200
What’s something dumb you thought as a kid?,18000,5,10100
Which subreddit was so toxic that you left and don’t regret it?,17000,4,11400
What’s a good science joke?,17000,0,3300
What’s an example of 100% chaotic neutral?,17000,0,3100
"At 2:32pm, your dog walked into your room, stared at you point blank, and said “nobody will ever believe you” before walking out. How do you react?",17000,4,2900
Hogwarts is closed for COVID. What remote learning alternatives are there for wizards and witches?,17000,1,1800
Have you ever witnessed a genuinely nice person get backstabbed for no apparent reason? What happened?,16000,4,2400
"Mental Health professionals, what “small” things do parents do that gives their kids mental health issues later in life?",16000,1,2900
What screams “I’m way richer than I look”?,15000,5,6400
What would you be doing right now if you didn't follow your moral compass?,15000,3,5200
"It is 1693 in Salem, Massachusetts and you've just been accused of being a witch. How do you prove your innocence?",14000,5,2800
"If you could teleport yourself only once, where would you go?",14000,5,3700
You will be given 10 million dollars in cash if you manage to cross the Pacific Ocean (California - Philippines) alive with a regular yacht and 3 months worth of food. Would you take the challenge? How would you do it?,14000,4,2500
"Interstate rest area and truck stop employees, what’s the most bizarre story you have?",14000,0,2200
"People who downloaded their Google data and went through it, what were the most unsettling things you found out they had stored about you?",13000,5,2200
"People that have played video games for extended periods, have you ever felt like you were still in the game even after you have stopped? If so, what happened?",13000,6,4400
What gender double standard really annoys you ?,13000,5,11300
[Serious] How many people have died from your high school class so far? How did they die?,13000,2,5100
"What song is a 10/10, yet not many people have heard of it?",12000,2,9700
"What movie's ending leaves you wanting a sequel but at the same time, you're afraid of a sequel because it would ruin the movie's ending and legacy?",12000,4,4500
What ruined religion for you?,11000,0,8500
What's the best song to play while having explosive diarrhea?,11000,2,3400
"Happy International Left-handers Day! To all the lefties in the world, what sets you apart from your right-handed counterparts?",11000,3,3300
It's 2052. Teens are romanticizing the year 2020 on a popular app. What do their videos look like?,11000,6,1400
"Disabled/Chronically Ill Redditors, what's the worst piece of advice someone has given you to ""cure"" your illness/disability?",11000,2,5600
What's something you've done your whole life but are still bad at?,11000,2,5100
You get $100 for every person you can bore to sleep with a lecture. What topic would you pick and what would you talk about?,11000,1,3700
What's the line between a brutally-honest friend and a toxic friend?,11000,4,1800
What was something you did as a kid that you thought was badass but as an adult you find cringy?,10000,1,4400
"You're not a serial killer, but a cereal killer. Which cereal do you want to get rid of and why?",10000,1,3500
What was the nicest thing someone has done for you?,10000,4,2400
How do you piss off an entire fandom?,10000,6,9000
What is a dead give away that someones apology is insincere?,10000,4,2800
"Surgeons of reddit, what was your ""oh shit"" moment ?",9000,4,2800
What is the most disrespectful thing a guest ever did at your home?,9000,0,5200
People who vocalize their yawns: Why?,9000,3,2200
What’s something unexplainable that you’ve experienced? [Serious],9000,5,4800
What is the best show that was canceled after just one season?,9000,3,8600
Redditors who took terrible advice from r/relationshipadvice . What happened?,9000,6,1400
"Redditors who have gone/were declared missing, what is your story?",9000,1,1700
"Professors of Reddit, have you ever looked yourself up on RateMyProfessor? What did you find?",8000,0,1200
Aliens come to earth and offer everyone free universal healthcare for the right of taking our corpses after we die. How would society and you react?,8000,6,2200
What is the worst text message you could wake up to?,8000,0,3200
What’s the coolest thing your wife’s boyfriend has ever let you do?,8000,5,1100
What's a fun history fact that not many people know?,8000,3,3600
"People who are motivated to do things, how the fuck do you do that?",8000,4,1900
What would be a terrible super power?,8000,1,3800
"People of Reddit, do you ever ignore text messages of your friends or family for no apparent reason? Why or why not?",8000,4,2400
"Therapists of Reddit, have you ever been genuinely scared of a patient and why?",8000,6,1500
"Redditors who have been in such severe and enduring physical pain that they honestly would have clicked an 'insta-death' button, what was the cause of your pain?",8000,6,4400
"If you were a serial killer, what would be your signature thing that you’d leave at every crime scene?",7000,1,4500
What was your “I’m in a toxic family” moment?,7000,6,3700
how would you compete against someone with a near infinite amount of money?,7000,5,1700
"British people of reddit, what is the most british insult you can think of?",7000,5,3600
"USPS employees, what madness is happening at your place of employment currently?",7000,5,1000
What are teens doing on the internet that adults have no idea about?,7000,2,3400
How did you get that scar?,7000,6,6500
Which person from real life would be able to lift Thor's hammer?,7000,5,3200
What game was worth every penny?,7000,3,6300
What annoys you the most about the pandemic?,6000,0,5800
"If Ms. Frizzle was a real person, what charges would she face in the court of law?",6000,5,882
"[Serious] Where is a ""nice"" place you visit on the internet to read but to get away from all the bad news?",6000,0,1300
"Window cleaners of Reddit, what are your stories you witnessed on the job?",6000,4,889
"Men of Reddit, what do you actually want your girlfriend to get you as a gift?",6000,0,3200
"Most people have a living room, bedroom and bathroom. What non-conventional 'room' is a game-changer?",6000,5,2500
What should we learn from this COVID-19 pandemic?,6000,4,3900
"To all the people who work as scarers in haunted houses, what were some of your best reactions?",6000,2,1300
People who fall asleep instantly: How?,6000,0,3300
What are some of the best lyrics you’ve heard?,6000,4,6400
"What was a ""dude, just go home"" kinda moment when you witnessed someone trying to impress people?",6000,3,1800
What are some websites frozen in time that are no longer updated?,5000,5,1300
"Deaf people, what goes through your mind when you see noise subtitles that are generic or you have never experienced?",5000,2,478
"Parents of reddit, when did you realise that it wasn’t teenage hormones, your kid is a legitimate butthole?",5000,5,1000
"Men of Reddit, what things that women find unattractive about themselves do you find very attractive, and why?",5000,5,3300
"Americans who grew up in the 90’s, how does the country’s spirit feel now compared to then?",5000,6,1900
What looks significantly scarier at 3:00 am?,5000,5,3200
What has 2020 taught you?,5000,5,2900
"Writers of reddit, what is your favorite story concept that you'll never actually write?",5000,0,1900
"If alcohol is a “social lubricant”, what would you consider a social contraceptive?",5000,5,2500
What legal thing are you addicted to?,5000,0,3800
"Girls, what’s the most obvious “I like you” hint you gave a guy, but for some reason they still didn’t get it?",5000,2,3100
[Serious] What is something that most people don't realize is anti-poor?,5000,1,3900
"How do you stop the ""Most humans suck"" mentality?",4000,4,1900
What's something you've been dying to say but had no one to tell?,4000,1,3100
"People WITHOUT depression and anxiety, what is life like?",4000,4,1300
"Your username is the cure to the coronavirus, what is it?",4000,2,7700
"If condom wrappers had inspirational quotes on the inside, what would be some good ones?",4000,0,1500
What do you add to enhance Mac and Cheese?,4000,4,3300
What nonsexual thing do you love doing when you're home alone?,4000,5,2400
What common practice do you find barbaric?,4000,1,6200
"If you could stop time for “20 minutes” once a day, what would you do in that time?",4000,3,2700
What do/did you hate the most about school?,4000,6,4000
"What if Gordon Ramsay had Bob Ross personality, and Bob Ross had Gordon ramsay's personality?",4000,4,760
"Jeff's of the world, how do you feel about Geoff's?",4000,4,831
"In your opinion, what is the best Stephen King book?",4000,0,2400
"Boys, what do girls do that gives you butterflies?",4000,1,2200
"Albert Einstein's last words were in German, but his attending nurse didn't speak German. So we don't know what his last words were, but what do you think they were?",4000,4,1300
What was something that happened in your school that caused a rule to be made?,3000,1,2600
What Is The Coolest Name you've ever Heard?,3000,0,3700
What is something you don't understand about humanity?,3000,4,2600
[Serious] What are some Cryptid/Ghost/Unexplained stories you'd be willing to share?,3000,1,1800
You have hacked Donald Trump’s Twitter profile. What’s the most damaging single tweet you could possibly send?,3000,3,2900
"What food has made you wonder: ""How did our ancestors discovered that this was edible?""",3000,0,2600
"Teachers of reddit, what is the stupidest reason a kid has told on someone else?",3000,2,1400
What’s the most savage thing you heard a child say to an adult?,3000,1,1600
"Men, what made you cry?",3000,4,3300
"Non-religious people of reddit, what do you think happens after you die?",3000,5,2900
What one time conversation with a complete stranger had the most profound impact on your life?,3000,6,721
"If you were in Avatar the Last Airbender, which of the 4 elements (water, earth, fire, air) would you want to control and why?",3000,3,2100
"If humans had a XP bar, what would increase XP and who would have the highest XP in the world ?",2000,2,1100
What is the one thing you realized during this pandemic?,2000,0,2900
What is the worst thing that you have laughed at In public?,2000,0,1100
"If someone offered you $1 million per year to never again drink alcohol, smoke cigarettes or marijuana, or use any sort of illegal drugs, which would you be willing to accept and what is the reasoning behind your decisions?",2000,1,2600
"What did you just recently learn that ""everybody knows""?",2000,4,4000
What appears romantic in movies but hardly is in real life?,2000,0,1700
"Men of reddit, what are your thoughts of women that ask you on a date?",2000,2,1500
What cool things could we do with America's dead/abandoned shopping malls?,2000,2,1700
What's a good reason to stay alive?,2000,1,1800
What was the dumbest thing you got punished for at school?,2000,2,3400
what’s one thing people do that makes you pissed off?,2000,6,2500
"What's a strange, but true fact about the human body?",2000,1,2600
"To the people who have keyboard clicking sounds on their phone, what's your reasoning for not turning it off?",2000,5,580
"If life was a video-game, what gameplay advice would you give to a beginner?",2000,6,1600
"Girls of reddit what are the most obvious hints you've ever given a guy, and he didn't get it?",2000,1,2000
What kind of people do you not respect?,2000,0,2700
"Introverts, how did you meet your girlfriend?",2000,3,1700
"In your opinion, what fictional character duo is the best and why?",2000,2,2000
What show has the greatest TV theme music ever?,2000,1,3500
What’s a good source for unbiased journalism?,2000,4,1600
What's a reference almost everyone will get?,2000,6,2900
what’s the best 2:17am snack to feed a very hungry man?,2000,5,1400
What were you known for in high/middle school?,2000,0,2000
What can you do to mess with future archeologists?,2000,1,729
What makes someone instantly likeable?,2000,2,950
What do you regret doing in a dare?,2000,2,1100
Attractive people of Reddit. What are some negative things that come with being attractive?,2000,2,2100
What famous picture actually has a disturbing backstory behind it?,2000,2,1000
What are some interesting questions to ask on a 1st date?,2000,4,1200
What three seemingly harmless words sound really creepy together?,2000,4,1500
What do you think is the most overrated movie ever?,2000,4,4400
What is the absolute worst way to die?,1000,0,2300
What real life things have 1 hp?,1000,5,1500
"High Schoolers of Reddit: What is the biggest “Oh Shit, shits about to go down!” moment that you’ve experienced with either students, teachers, or even both?",1000,3,1100
What popular quote is complete bullshit?,1000,0,2300
"People of Reddit, in what categories are you above average?",1000,3,2000
What’s one thing you deeply regret?,1000,2,1400
"What simple, daily habit changed your life?",1000,3,1200
"If Nintendo called you up and said ""Hey, we outta ideas for new dlc characters for smash, so we're just calling up random numbers to see who they think should get in the game. Who you want?"" What would you tell them?",1000,5,2000
"You wake up in god mode only for 24 hours, what are you going to do?",1000,2,1700
"Gamers of Reddit, what dead video game series would you revive and why?",1000,1,3400
What do you think makes a good person?,1000,6,909
Whats a terrifying fact that keeps you up at night?,1000,5,1600
"Men of Reddit, what‘s the most ""girly"" thing you do on a regular basis?",1000,5,2300
What are some strangely specific subreddits that most people don't know exist?,1000,4,988
"You can permanently remove 1 thing from the internet, what is it?",1000,2,2000
What do you wish more people understood?,1000,1,1800
What’s your random advice?,1000,4,2000
What can kill you in a LITERAL split-second?,1000,6,1600
"Women, what do you not understand about men?",1000,6,4700
What will be 2020's final boss?,1000,4,2200
What’s a story you’ve wanted to tell on here for a while but haven’t had the right question come up?,1000,0,960
"What game gave you so much paranoia, that you deleted or stopped playing the game?",1000,3,1500
"People who have never been able to see, what's your definition of beauty?",1000,2,351
"People who've been in psych wards, what was your experience?",1000,2,885
"[Serious] After spending time in a foreign country, whats something you learned that you took back to your home country?",1000,2,1600
What dark videogame moment are you still trying to get over?,1000,5,2300
Whats the most embarrassing way to die?,1000,4,1300
"Elon Musk said that AI is already better than humans in all, if not most, activities, what activity will AI never match humans?",1000,0,1700
"What is one thing about your country that foreigners believe, but it's actually false?",1000,4,2800
What exists just to make life hard?,1000,4,1600
"What’s the worst way of dying, in terms of pain?",1000,4,1600
What borders on stupidity?,1000,0,999
What’s the one song you listen to but don’t feel comfortable with others knowing you listen to it?,1000,5,1500
"Women of Reddit, what is the hardest thing to explain to a man?",1000,5,2600
"(Serious) 911 phone operators, what do you do when you recieve phone calls from 'karen' types?",1000,0,316
"Without saying their name, who’s your favorite singer/band?",1000,1,4300
What was your “I’m done with this friendship” moment?,1000,6,1300
What's your favorite video game without saying it?,1000,5,3900
"What if when you die, you find yourself in an alien body, holding a bong, around a bunch of aliens asking you ""How was it""?",1000,4,295
What are some things on this planet people don't appreciate enough?,1000,1,1100
"Ex-prisoners of Reddit, what was the scariest thing you've seen on prison?",1000,1,687
What is the strangest Bible verse people probably don’t know about?,1000,5,1200
What is something you desperately want to know the truth about?,1000,2,1600
